{"decisions":[{"after":"blank","before":"sample","kind":"role","note_sha256":"edb465624291e4053c6c5ea4b7eb320dec773e10a57d26b95dcf0564f8e310f8","seq":1,"target":"BLK_P1"}],"engine":{"commit":"0000000000000000000000000000000000000001","modules":{"feat":"31912da8bf3f971451718c339b621c833d0244407f1116eb2b54ee683f299e96"},"name":"mzLab","platform":"native","version":"1.0.0"},"inputs":[{"alias":"S01","bytes":1000,"injection_order":2,"polarity":"+","replicate":1,"role":"sample","series":"A","sha256":"ac7438e86cb85ebd90f4d0abb235f9a28f112e1ec0b7995156f3d5e868d315f8","type":"mzml"},{"alias":"BLK_P1","bytes":900,"injection_order":1,"polarity":"+","replicate":1,"role":"blank","series":"A","sha256":"13edb9193084a1dfdf5f094f57a35e027577bfdf248525e2b5560d74362bcb94","tipo_bianco":"procedure","type":"mzml"}],"kind":"record","limits":[{"code":"vendor.conversion.external","detail":"synthetic"}],"min_reader":1,"plan":{"format":"mzflow/2","inputs":[{"bytes":1000,"name":"S01","sha256":"ac7438e86cb85ebd90f4d0abb235f9a28f112e1ec0b7995156f3d5e868d315f8","type":"mzml"},{"bytes":900,"name":"BLK_P1","sha256":"13edb9193084a1dfdf5f094f57a35e027577bfdf248525e2b5560d74362bcb94","type":"mzml"}],"program":{"name":"mzLab","version":"1.0.0"},"steps":[{"id":"detect","in":{"source":["file:S01","file:BLK_P1"]},"params":{"ppm":5},"step":"features.detect@1"}]},"plan_sha256":"47ca53a2bee6d4a7eff7f5cf055218e7ba12da1f7b1091204220b808f335ca43","prov":{"activity":{"detect":{"generated":["detect.peaks[0]","detect.peaks[1]"],"params_sha256":"d40aadf5fded390e243babf22275fa6f2d1c76f10e689a6c58025e97e907507a","step":"features.detect@1","used":["file:S01","file:BLK_P1"]}},"agent":{"commit":"0000000000000000000000000000000000000001","name":"mzLab","platform":"native","version":"1.0.0"},"entity":{"file:BLK_P1":{"sha256":"13edb9193084a1dfdf5f094f57a35e027577bfdf248525e2b5560d74362bcb94","type":"mzml"},"file:S01":{"sha256":"ac7438e86cb85ebd90f4d0abb235f9a28f112e1ec0b7995156f3d5e868d315f8","type":"mzml"}},"plan_sha256":"47ca53a2bee6d4a7eff7f5cf055218e7ba12da1f7b1091204220b808f335ca43","schema":"prov/1"},"related":{"doi":"10.5281/zenodo.0000000"},"resolved":{"detect":{"algorithm":"masstrace@1","estimates":{"min_scans":{"basis":"synthetic"}},"params":{"min_scans":3,"ppm":5},"pin":{"min_scans":"estimate","ppm":"fixed"},"step":"features.detect@1"}},"resources":[{"builtin":true,"bytes":120,"id":"adducts-default","kind":"adducts","sha256":"728f1a3fa88a6b2b3f27b6f717e6fafe19c3be69c5f648b47931b7660e56ab77","version":"1"}],"results":{"entities":{"detect.peaks[0]":"169b5b823c62b64ca7e5f8456a13c8d5d06f4ece522a58bc2b8a784dcf3609b0","detect.peaks[1]":"f64551fcd6f07823cb87971cfb91446425da18286b3ab1ef935e0cbd7a69f68a"},"results_digest":"463b736c1c686d948e4ee210824e2d84b4bf56e6d048d8ad4761ff3091c47795"},"revisions":0,"roles_sha256":"66cf5513b37462be52e7fe7b1791b7a6b704f97577680acc2f270e365a1b01e3","schema":"mzrun/1","seeds":{"detect.init":7},"self_sha256":"0593a6c739e1d3a3ed599f32532f613a65099723955ab7f2d7a6e4f577293bb4"}
