{"compat":{"changes":[{"confirmed":true,"instance":"detect","kind":"new","param":"min_scans","value":3}],"from_engine":{"commit":"0000000000000000000000000000000000000001","modules":{"feat":"31912da8bf3f971451718c339b621c833d0244407f1116eb2b54ee683f299e96"},"name":"mzLab","platform":"native","version":"1.0.0"}},"engine":{"commit":"0000000000000000000000000000000000000001","modules":{"feat":"31912da8bf3f971451718c339b621c833d0244407f1116eb2b54ee683f299e96"},"name":"mzLab","platform":"native","version":"1.0.0"},"kind":"preset","limits":[{"code":"vendor.conversion.external","detail":"synthetic"},{"code":"preset.param.new"}],"min_reader":1,"plan":{"format":"mzflow/2","inputs":[{"name":"sample.main","sha256":"0000000000000000000000000000000000000000000000000000000000000000","type":"mzml"},{"name":"blank.procedure","sha256":"0000000000000000000000000000000000000000000000000000000000000000","type":"mzml"}],"program":{"name":"mzLab","version":"1.0.0"},"steps":[{"id":"detect","in":{"source":["file:sample.main","file:blank.procedure"]},"params":{"ppm":5},"step":"features.detect@1"}]},"plan_sha256":"cdc57c77f7202e0e95bd43df9aebd65c8790bbf3828f58656ca20d20ad7d73c0","resolved":{"detect":{"algorithm":"masstrace@1","estimates":{"min_scans":{"basis":"synthetic"}},"params":{"min_scans":3,"ppm":5},"pin":{"min_scans":"estimate","ppm":"fixed"},"step":"features.detect@1"}},"resources":[{"builtin":true,"bytes":120,"id":"adducts-default","kind":"adducts","sha256":"728f1a3fa88a6b2b3f27b6f717e6fafe19c3be69c5f648b47931b7660e56ab77","version":"1"}],"revisions":0,"schema":"mzrun/1","seeds":{"detect.init":7},"self_sha256":"c69c495128ee8fe08fa8ac2bcbd4478b839400c30cc54c13ecb07e12d47d8c1c","slots":[{"min":1,"polarity":"+","role":"sample","slot":"sample.main","type":"mzml"},{"max":1,"min":1,"polarity":"+","role":"blank","slot":"blank.procedure","type":"mzml"}]}
